Sheet: Plan1
A1: Nomes | B1: Tipo | C1: Vagas | F1: VAGAS
A2: Administração noturno | B2: H | C2: 6 | D2: B | E2: B biologicas | F2: of:=SUMIF([.$B$2:.$B$63];[.D2];[.$C$2:.$C$63]) -> 33 | G2: of:=[.F2]/[.$F$5] -> 0.20625
A3: Administração pública | B3: H | C3: 2 | D3: H | E3: H Humanas | F3: of:=SUMIF([.$B$2:.$B$63];[.D3];[.$C$2:.$C$63]) -> 50 | G3: of:=[.F3]/[.$F$5] -> 0.3125
A4: Arquitetura e Urbanismo | B4: H | C4: 3 | D4: E | E4: E Exatas | F4: of:=SUMIF([.$B$2:.$B$63];[.D4];[.$C$2:.$C$63]) -> 77 | G4: of:=[.F4]/[.$F$5] -> 0.48125
A5: Artes Cenicas | B5: H | C5: 2 | F5: of:=SUM([.F2:.F4]) -> 160
A6: Artes Visuais | B6: H | C6: 2
A7: Ciencias Economicas I | B7: E | C7: 2
A8: Ciencias Economicas N | B8: E | C8: 3
A9: Ciencia da computação N | B9: E | C9: 2
A10: Licenciatura em ciencias biologicas | B10: H | C10: 2
A11: Ciencias Biologicas | B11: B | C11: 2
A12: Ciencias do esporte | B12: B | C12: 2
A13: ciencias sociais I | B13: H | C13: 2
A14: ciencias sociais N | B14: H | C14: 2
A15: Comunicação social - Midialogia I | B15: H | C15: 3
A16: Dança | B16: H | C16: 1
A17: Educação Fisica I | B17: B | C17: 2
A18: Educação Fisica N | B18: B | C18: 2
A19: Enfermagem | B19: B | C19: 4
A20: Eng Agricola | B20: E | C20: 3
A21: Eng Ambiental | B21: E | C21: 3
A22: Eng Civil | B22: E | C22: 3
A23: Eng de alimentos I | B23: E | C23: 2
A24: Eng de alimentos N | B24: E | C24: 2
A25: Eng de computação | B25: E | C25: 1
A26: Eng de Controle e automação | B26: E | C26: 1
A27: Eng de Manufatura | B27: E | C27: 2
A28: Eng de produção | B28: E | C28: 2
A29: Eng de telecomunicações | B29: E | C29: 2
A30: Eng eletrica I | B30: E | C30: 1
A31: Eng eletrica N | B31: E | C31: 1
A32: Eng Mecanica | B32: E | C32: 1
A33: Eng Quimica I | B33: E | C33: 1
A34: Eng Quimica N | B34: E | C34: 2
A35: Estatística | B35: E | C35: 5
A36: Estudos Literários I | B36: H | C36: 2
A37: Farmácia I | B37: B | C37: 5
A38: Filosofia I | B38: H | C38: 3
A39: Licenciatura em Fisica N | B39: E | C39: 2
A40: Fonoaudiologia | B40: B | C40: 2
A41: Geografia I | B41: H | C41: 1
A42: Geografia N | B42: H | C42: 2
A43: Geologia | B43: H | C43: 2
A44: Historia | B44: H | C44: 4
A45: Letras - Licenciatura | B45: H | C45: 2
A46: Licenciatura em letras- PORT | B46: H | C46: 2
A47: Licenciatura integrada quim/fis | B47: E | C47: 3
A48: Linguistica | B48: H | C48: 2
A49: Licenciatura em matematica | B49: E | C49: 10
A50: matematica fis matem aplicada e comp | B50: E | C50: 5
A51: medicina | B51: B | C51: 10
A52: musica | B52: H | C52: 1
A53: nitrição | B53: B | C53: 2
A54: odontologia | B54: B | C54: 2
A55: pedagogia I | B55: H | C55: 2
A56: pedagogia N | B56: H | C56: 2
A57: quimica | B57: E | C57: 4
A58: quimica tecnologica | B58: E | C58: 3
A59: sistemas de informação | B59: E | C59: 2
A60: curso superior de tecnologia e analise de desenvolvimento de sistemas | B60: E | C60: 2
A61: curso superior de tecnologia em construçao de edificios | B61: E | C61: 3
A62: curso superior de tecnologia em controle ambiental I | B62: E | C62: 2
A63: curso superior de tecnologia em controle ambiental N | B63: E | C63: 2
C64: of:=SUM([.C2:.C63]) -> 160